,Organisation,NGO Listing Page,Classified Category,Registration ID,Year of Foundation,Address,Telephone,Mobile,Email,Website,Twitter,Facebook,Description,Activities,Name in Myanmese,Further Links
0,Maggin Development Consultancy Group,https://ngo.mycitizen.net/directory/listing/maggin-development-consultancy-group,"Emergency Relief/Water, Sanitation and Hygiene (WASH)/Disaster risk reduction (DRR)/Social Service/Livelihood and Food Security",၁/ ျပည္တြင္း/ ၀၀၈၀,2012,"Yadanar Myaing Street, Kamayut Township, Yangon, Yangon, Myanmar",+95 0949641582,+95 73058970,mdcg@mdcg-myanmar.org,http://www.mdcg-myanmar.org,NA,https://www.facebook.com/MDCG.MM,"MDCG was founded by a group of 13 like-minded individuals who share common vision and aspirations for a peaceful and modern Myanmar. The renewed fighting in Kachin State in 2011/2012 and the slow response by the international community brought the group – back then many of them were simply private donors – together in an effort to join forces to alleviate the suffering caused to the thousands of innocent civilians affected by the conflict.The diverse background and wide-range of technical expertise of the core group has provided MDCG with a unique multi-ethnic and multi-sectoral make-up and a sound programming foundation. Most members of the founding group and the current staff have years of experience working in humanitarian and development programs in rural Myanmar at grass-roots level. Their work and program conception are guided by humanitarian principles, rights based approach, international norms and standards, and well adapted to local context and culture. MDCG staff comprises of a well-balanced pool of experienced social workers with community development experiences from several years of working with INGOs and/or LNGOs, and retired persons of government departments with extensive networks and financial management skills. The diversity and strong professional competences of staff has helped MDCG to gain momentum and to transition from a low profile CBO to a full profile NGO.While saving lives and alleviating immediate suffering are first priority of MDCG intervention, MDCG recognizes the urgent need for more advanced and sustainable development in remote villages, especially in ethnic minority areas that have been neglected for so many decades. So, to achieve highest impact of recovery, MDCG aims to accompany all relief efforts with livelihoods and infrastructure rehabilitation in integrated fashion. MDCG staff is dedicated to help people in these remote areas and challenging environments and therefore are principally based in the field. Similar to CBOs, MDCG field staff work through community networks (women’s associations, volunteer groups, VDC, etc) to strengthen their capacity and community ownership of the project. Community participation and contribution play an integral element in MDCG conception and implementation of projects.",Emergency RespondWater and Sanitation Basic InfrastructureMine Risk Education Health Peace and Reconciliation Disaster Risk Reduction,မဂၢင္ လူမႈဖြံ႕ၿဖိဳးမႈဆိုင္ရာ အကူအညီေပးေရးအဖဲြ႕,NA
1,Youth Pacemaker Organization,https://ngo.mycitizen.net/directory/listing/youth-pacemaker-organization,Capacity Building,NA,2015,"Mandalay Region, Myanmar (Burma)",NA,+95 9798933530,youthpacemaker@gmail.com,NA,NA,NA,Participation in Good Governance,Capacity BuildingParticipation in Governance workshop,NA,NA
2,Helping Hands Myanmar,https://ngo.mycitizen.net/directory/listing/helping-hands-myanmar,Capacity Building/Advocacy/Film/Livelihood and Food Security/Environment/Human Rights/Humanitarian Aid/Media/Social Business/Women,NA,2012,"Helping Hands office, Kalay, Chin State, Myanmar (Burma)",+95 9262281828,+95 9 967196555,hho.information@gmail.com,NA,http://twitter.com/dktuang,http://www.facebook.com/helpinghands.mm,"Helping Hands Organization has experiences of training on enhancing capacity of community leaders’ democracy and human rights with the support of Paung Ku in 2012. In 2013, Helping Hands organization received People In Need (PIN)’s fund to provide Civic Education and Political awareness trainings and organize workshop and community level platform for 10 times. In resulting of strong participation and coordination of community leaders and strong networking, community based organizations (CSOs) as such Mwe Taung local development group and Nan Lui Kual local development organizations come out. Currently, Myay Taung Local development group are taking a leading role on land issues of Mwe Taung Red Copper project and Chin State and Sagaing Boundary problems. Then, Nan Lwe Kwel local development group are involving and coordinating with Helping Hands in the local development activities. In 2014, Helping Hands organized conference on democracy talk with the support of Dana Shae Saung Myanmar from Yangon, 88 generation (Kalay) and upper Chindwin youth network and the participants from different stakeholders included township and Regional level political leaders, government departments and civil society. HHO organized women conference and meeting for land issue/confiscation. From 2014 March to 2015, in partnership with FSWG, the project of multi-agriculture and livestock breeding was implemented by LIFT support. For Women Empowerment, HHO give Microfinance to the Home Shop owners and Women handmade, weaver. Women Weaving Group is begin in 2013, and Helping Hands Credit Union is form in 2014 then, there is about 300 members, 98% is women.","Training,Workshop,Conference",NA,NA
3,Stiftunglife,https://ngo.mycitizen.net/directory/listing/stiftunglife,School/Capacity Building/Vocational Training/Psychosocial Services/Environmental Conservation,NA,1989,"Yangon, Yangon Region, Myanmar (Burma)",00495141207173,00491704512312,info@stiftunglife.de,http://www.Stiftunglife.de,NA,https://www.facebook.com/stiftung2016/?fref=ts,"Die Stiftunglife ist eine 1989 gegründete deutsche gemeinnützige Stiftung, die am besten für ihre Unterstützung der Tafeln zur Ausgabe von Lebensmitteln an Bedürftige bekannt ist. Sie verfolgt jedoch den Grundsatz, dass ihre Mittel je zur Hälfte in Deutschland für die Tafeln und benachbarte Tätigkeiten und zur anderen Hälfte im Ausland eingesetzt werden. Der Schwerpunkt in Myanmar liegt in der Förderung Studenten, denen ein Studium ermöglicht wird, im Bau von Schulen und im Betrieb der Swimming Doctors, die die medizinische Versorgung im Delta verbessern. Die Wasserqualität an den inzwischen über 50 Schulen wird durch PAUL, einem Wasserfilter, verbessert. In Dörfern ohne Elektrizität werden die Kerosinlampen durch sauberes Solarlicht ersetzt und in Bagan wird gerade eine Plastikrecyclingfabrik gebaut.","Im Sommer 2016 werden die Swimming Doctors III fertiggestellt, die ebenfalls im Delta von Myanmar eingesetzt werden sollen.",Stiftunglife,http://www.Stiftunglife.de
4,Yello generation wave,https://ngo.mycitizen.net/directory/listing/yello-generation-wave,Children,NA,2012,89MILE 5FALLON YANGON MANDALAY HIGHWAY ROAD,09780000085,09785757620,NA,NA,NA,NA,We are providing children all over the country and providing education aid.,we have nearly 200 children in my monastry.,အဝါ​ေ၇ာငင္​မ်ိဳးဆက္​သစ္​လူငယ္​ပ၇ဟိတအသင္​း,NA
5,Brainworks-Total International School Yangon,https://ngo.mycitizen.net/directory/listing/brainworks-total-international-school-yangon,Education,NA,NA,"41, Myanmar (Burma)",NA,NA,NA,http://www.brainworks-total.com,NA,NA,"Brainworks-Total Group of schools are located in the Southeast Asian country of Myanmar. In the Ten years since our founding, Brainworks-Total Group of Schools has expanded to 11 branches with over 2500 very motivated students, and 400 dedicated teachers",Brainworks-Total Group of schools are located in the Southeast Asian country of Myanmar. In the Ten years since our founding,NA,NA
6,Australia-Asia Program to Combat Trafficking in Persons,https://ngo.mycitizen.net/directory/listing/australia-asia-program-to-combat-trafficking-in-persons,Legal Support,NA,2013,"No. 100, Kan Kaw Myaing Road, Parami, Yankin Township, Yangon, Myanmar",+95-1657975,NA,info@aaptip.org,http://www.aaptip.org/,NA,NA,"The Australia-Asia Program to Combat Trafficking in Persons (AAPTIP: 2013-18) builds on the success of ARCPPT and ARTIP. AAPTIP will operate at both regional and national levels. It will provide support to the Association of South East Asian Nations (ASEAN), working with the ASEAN Secretariat (ASEC), regional anti-human trafficking bodies and individual partner countries.Human trafficking is the illegal trading of human beings for the purpose of labour, sexual and other forms of exploitation. It is a crime that can occur within a country or across national borders. Trafficking contravenes fundamental human rights, denying basic and broadly accepted individual freedoms to women, men and children all over the world. It has wide economic, social and political impacts, and has serious consequences for development in South East Asia.Diverse but integrated responses are needed to effectively combat human trafficking through prevention, prosecution and protection. Since 2003, Australia has invested more than $50 million across these three approaches. Australia is one of the few donors to support the criminal justice response to human trafficking through the Asia Regional Cooperation to Prevent People Trafficking (ARCPPT: 2003-6) and the Asia Regional Trafficking in Persons Project (ARTIP: 2006-12).AAPTIP GOALTo reduce the incentives and opportunities for the trafficking of persons in the ASEAN region.AAPTIP OBJECTIVESAssistance will be provided to regional and national stakeholders to achieve the following outcomes:– Law enforcement agencies improve the effective and ethical investigation of human trafficking cases;– Prosecutors improve the effective and ethical prosecution of human trafficking cases;– Judges and court officials improve the fair and timely adjudication of human trafficking cases;– Regional bodies enhance regional cooperation and leadership on the criminal justice response to human trafficking in the ASEAN region.Working through existing local planning and delivery mechanisms, AAPTIP will support the development and implementation of work plans by counterparts at two levels:national, by supporting annual plans developed by each national program steering committee;regional, by supporting the ASEAN Secretariat, the ASEAN Trafficking in Persons Working Group of the Senior Officers Meeting on Transnational Crime (SOMTC TIP WG), and the Heads of Specialist Unit (HSU) processSTAFFING & SUPPORTAAPTIP is managed by AAPTIP DFATs Asia Regional Programs office in Thailand.Cardno Emerging Markets, the Implementation Service Provider, is based in Thailand, with national country program coordinators and national monitoring and evaluation officers in Cambodia, Indonesia, Lao PDR, Myanmar, Philippines, Thailand and Vietnam.AAPTIP will provide high quality technical advice and support through a team of internationally experienced and qualified specialists.DFATs East Asia Regional has appointed a Partnership and Advocacy Manager, based in Thailand, to drive Australia strategic dialogue on trafficking with key stakeholders.","12th Bilateral Meeting between Myanmar Police Force (MPF) and Thailand Department of Special Investigation (DSI) on Cross-border Human Trafficking and other related Transnational Crime4th Thai-Myanmar Law Enforement and Criminal Justice Cooperation MeetingTri-lateral Meeting between Indonesia, Myammar, and Thailand to Discuss Trafficking in Persons in the Fishing Industry2nd Workshop on Precedures for Informing Trafficking Victims of their Rights and the Criminal Justice ProcessesASEAN SOMTC TIP Working Group Consultation MeetingEtc.",NA,NA
7,Agency for Education of the Poor Rural Youth,https://ngo.mycitizen.net/directory/listing/agency-for-education-of-the-poor-rural-youth,"Rural Development/Vocational Training/Water, Sanitation and Hygiene (WASH)",pa/0039,2014,"Yangon, Yangon Region, Myanmar (Burma)",+95 - 931449092,+95 - 9261644801,info@aeprymm.com,http://www.aeprymm.com,http://twitter.com/aeprymyanmar,https://www.facebook.com/Aeprymyanmar,Agency for Education of the Poor Rural Youth (AEPRY) is a temporary registered non-government organization in Myanmar. AEPRY mainly focus on sustainable rural development and job oriented education.,"AEPRY has implemented five seven rural development projects (2 Primary Schools, Two Bridges, Two Water Supply and one Rural Health Center for the people in Kalay Township and Tonzang Township.",ေက်းလက္ေဒသရွိဆင္းရဲသားလူငယ္မ်ား၏ ပညာေရးျမွင့္တင္ေရးအဖြဲ႕,NA
8,"Zomi Innkuan USA, Inc.",https://ngo.mycitizen.net/directory/listing/zomi-innkuan-usa-inc,Social Service/Advocacy/Human Rights/Women/Humanitarian Aid,NA,NA,"7438 S. 95th East Ave. Tulsa, OK 74133, USA",+1-918-576-4174,NA,zomicommunityusa@gmail.com,http://www.zomicommunityusa.org/,NA,https://www.facebook.com/ZomiCommunityUSA,"Zomi Innkuan USA is incorporated in the State of Oklahoma andexempt from Federal Income Tax as a Public Charity of Section 501(c) 3,with EIN # 26-4145898.Zomi Innkuan USA, Inc. is in Consultative Status withUnited Nations Economic and Social Council since July 2014.","Representative of Zomi Innkuan USA which is in Consultative Status with UN ECOSOC attended the Ministerial Conference on Civil Registration and Vital Statistics in Asia and the Pacific held in Bangkok, Thailand from Nov. 24 to Nov. 28, 2014. Thanks to the United Nations Economic and Social Commission for Asia and the Pacific (ESCAP), Bangkok, Thailand.",NA,NA
9,International Schools in Yangon,https://ngo.mycitizen.net/directory/listing/international-schools-in-yangon,Education,NA,NA,"Brainworks-Total K-12 Integrated School, 1 Thumingalar Street, 16/4 Quarter, Thingangyun, Yangon, Union of Myanmar",8551361,9518551360,brainwork.total@gmail.com,http://www.brainworks-total.com,NA,https://www.facebook.com/pages/Internationalschoolinyangon/1404152136518658?ref=hl,Providing best educational services in Yangon Myanmar,Brainworks-Total best educational school in Yangon Myanmar,NA,NA
10,Myanmar Orphans Support Network,https://ngo.mycitizen.net/directory/listing/myanmar-orphans-support-network,Children/Psychosocial Services,NA,2009,"255 Aung Thit Sar Street, Yangon, Yangon Region, Republic of the Union of Myanmar",+959421137052,NA,NA,NA,NA,https://www.facebook.com/groups/88745803980/,"This network is founded by youth people who live in Myanmar (Burma). We are supporting orphans and poor child from our country. We will also do others motivation activities for orphans. You are welcome to join our group and help the children.Our VisionSupporting the vulnerable children, including orphans for building the sustainable development of the country.Our MissionTo help and support the orphans in terms of education, health care, nutrition and other social welfare.",What we do?Supporting the orphansEducating the orphansEmpowering the orphansVocational and psychological training for the orphansLife Skill training What are our regular programs?Psycho-social Support ProgramHealth Care ProgramDental Care ProgramPersonal Hygiene Program Knowledge Sharing Program for volunteersEnvironmental Education Program,NA,NA
11,Myanmar Youth Network,https://ngo.mycitizen.net/directory/listing/myanmar-youth-network,Capacity Building/Children,NA,NA,"Yangon, Yangon Region, Republic of the Union of Myanmar",NA,"+ 95 (0) 9 5087234, + 95 (0) 9 5044120",NA,NA,NA,https://www.facebook.com/MyanmarYouthNetwork,"Youth-led civil society organization for youth mobilization and advocacy to initiate strong civil society and voice the Myanmar youth concerns in the international community.Vision:Educating and instilling young people in modern thoughts to work towards the welfare of the world by contributing peace, justice, harmony and loving kindness.Mission:Young people with sincerity, cooperation, cohesion and perseverance shall create a peaceful, harmonious and beautiful world.Objectives:The general objectives stated in the legal basis of the Myanmar Youth Network are to:Promote tolerance and mutual understanding among young people.Foster candid cooperation habit among young people.Encourage young people to energetically participate in social works.Train and develop young people in becoming effective leaders in our society.Educate young people to keep abreast of the world.",workshops,NA,NA
12,Pandita Development Institute (PDI),https://ngo.mycitizen.net/directory/listing/pandita-development-institute-pdi,Democracy Promotion,NA,2011,"93, Seikkanthar Street, Kyauktada, Yangon, Yangon Region",+95 (0) 9 250 587 279,+95 9 508 7234,info@pandita.asia,http://www.pandita.asia,http://twitter.com/PDI_ORG,https://www.facebook.com/PanditaDevelopmentInstitute/,"Pandita Development Institute (PDI) is a civil society organization, which is to promote the citizen participation and practice democratic principles in the society.MissionTo build a democratic nation in which sustainable development is embedded by the active citizens and mission is community leaders with sincerity, collaboration, perseverance and cohesion shall create the peaceful, harmonious and democratic country.",see http://www.pandita.asia/?q=globalization,ပဏ္ဍိတဖွံ့ဖြိုးရေးအင်စတီကျု,https://www.youtube.com/user/PDICHANNEL
13,Karen Women Organisation (KWO),https://ngo.mycitizen.net/directory/listing/karen-women-organisation-kwo,Women,NA,1949,"P.O. Box 19, Mae Sariang, Mae Hong Song Province 58110, Thailand",(66) 053-681-084,NA,kwocentral@gmail.com,http://karenwomen.org,NA,NA,"To assist women in the endeavour to be free from all forms of oppression.To promote and empower women in all spheres of life, including education and general living standards.To encourage women to participate in the struggle for freedom, democracy and equality.To develop women’s knowledge, ability and skills, including political and organisational skills.To achieve the rights of women and equal status with men.To promote and maintain Karen culture and traditions.To improve the well being of women and children and to increase their access to adequate health, education and welfare service",see http://karenwomen.org/kwo-every-2-year-reports/,NA,NA
14,Karenni National Women's Organization,https://ngo.mycitizen.net/directory/listing/karenni-national-womens-organization,Women/Children/Capacity Building/Advocacy,NA,1993,"P.O. Box 31 , Mae Hong Son 58000, Thailand",NA,+660806738315,knwocent@gmail.com,http://karenniwomen.org,NA,NA,"To empower Karenni women to play a leadership roleTo organize education, income generation and other projects for the benefit of the entire Karenni refugee populationTo increase international awareness of the Karenni situationTo promote gender equality and fight all forms of discriminationTo preserve the customs, literature and languages of the Karenni peopleTo promote and advocate for women and child rightsTo take care of women who are affected by violence","Capacity BuildingChild DevelopmentWomen and Children ProtectionVocational DevelopmentDocumentation, Research and Advocacy",NA,NA
15,Palaung Women's Organization,https://ngo.mycitizen.net/directory/listing/palaung-womens-organization,Women,NA,NA,"P.O. Box 98 Mae Sot, Tak 63110, Thailand",+66 (0) 55-546-60,NA,pwotaang@gmail.com,http://eng.palaungwomen.com/,NA,NA,"We are Palaung women who will advocate and advance the statues of women in field of development and working forwards achieving gender equality, justice, peace and democratic society.",PROJECTS AND PROGRAMSWomen’s Political Development ProgramYoung Women’s Capacity Building TrainingInternship ProgramEliminating Violence Against Women ProgramCrisis CenterHealth ProgramIncome Generation ProjectInformation and Documentation Research DepartmentADVOCACYExternal AdvocacyInternal Advocacy,NA,NA
16,Kachin Women's Association Thailand,https://ngo.mycitizen.net/directory/listing/kachin-womens-association-thailand,Women,NA,1999,"PO Box 415, Chiang Mai, Thailand, 50000",+66 (0) 897559892,NA,kwat@loxinfo.co.th,http://www.kachinwomen.com,NA,NA,The empowerment and advancement of Kachin women in order to improve the lives of women and children in Kachin society.,Documentation & Research ProgramCapacity Building ProgramAnti-Trafficking ProgramHealth ProgramMigrant Worker ProgramIncome Generation Activities,NA,NA
17,Shan Human Rights Foundation,https://ngo.mycitizen.net/directory/listing/shan-human-rights-foundation,Human Rights,NA,1990,"Prasingh P.O., 50205 Chiang Mai, Thailand",+66(0)93- 297-7754,NA,shrf@shanhumanrights.org,http://www.shanhumanrights.org/,http://twitter.com/shanhumanrights,https://www.facebook.com/pages/Shan-Human-Rights-Foundation-SHRF/167914939914699,"To strive for human rights and restore justice to the victims;To promote democracy in accordance with the desire and will of the people, and establish a popular government based on democratic principles;To strive for unity, fraternity, equality and cooperation;To strive for world peace, freedom and prosperity.","Since 1997, SHRF has been producing regular reports on human rights violations in Shan State in the form of monthly newsletters in English. These reports are sent to relevant organizations and institutions, and are also posted on the internet.Since 1999, SHRF has also been producing the monthly report in Shan, in order to raise human rights awareness among Shan communities on both sides of the Thai-Shan border, as well as inform them about human rights violations in Shan State.SHRF also carries out research and periodically publishes detailed reports on specific issues related to human rights in Shan State.",NA,NA
18,Free Burma Rangers,https://ngo.mycitizen.net/directory/listing/free-burma-rangers,Health/Humanitarian Aid,NA,1997,"P.O. Box 14, Mae Jo, Chiang Mai, 50290, Thailand",NA,NA,info@freeburmarangers.org,http://www.freeburmarangers.org,NA,https://www.facebook.com/freeburmarangers,"The Free Burma Rangers (FBR) is a multi-ethnic humanitarian service movement. They bring help, hope and love to people in the war zones of Burma.","The Free Burma Rangers (FBR), conduct relief, advocacy, leadership development and unity missions among the people of Burma.",NA,NA
19,The Border Consortium (TBC),https://ngo.mycitizen.net/directory/listing/the-border-consortium-tbc,Refugees/Internally Displaced Persons (IDPs),NA,NA,12/5 Convent Alley Bang Rak Bangkok 10500 Thailand,+66 (0) 2238 5027,NA,tbc@theborderconsortium.org,http://theborderconsortium.org/,NA,NA,"TBC is a consortium of 10 international non-governmental organisations (NGOs) from eight countries. TBC’s main focus is to provide food, shelter and capacity-building support to Burmese refugees and displaced persons. The refugee camps are the key locations for current activities, where TBC also provides support for camp management through the refugee committees. TBC also conducts research into the ongoing causes of internal displacement in South East Burma.",services for Burmese refugees in Thailand and bordering Burmese regions,NA,NA
20,Helping Hands Organization,https://ngo.mycitizen.net/directory/listing/helping-hands-organization,Advocacy/Capacity Building/Development Aid/Education/Environment/Human Rights/Social Business/Women,In process,2012,"12/6 Taungzalatt, Tahan, Kalay Myo, Sagaing/ Chin State",+95 9 73254176,+95 9 33503345,hho.myanmar@gmail.com,NA,http://twitter.com/dktuang,http://www.facebook.com/helpinghands.mm,To get Equal Right and Equal Opportunity in Myanmar.,"Civic Education and Political Awareness.Human Right Education TrainingEnvironment ConcernLand Laws and Land Rights.Model Farming,( Goat, Pig and Chicken)",ကူညီလက္မ်ား(ျမန္မာ) BanZaal,NA
21,Wathann Film Institute (WFI),https://ngo.mycitizen.net/directory/listing/wathann-film-institute-wfi,Film,NA,2011,"15(3B), Obo street (Near Yay kyaw, Shwe Pone Pwint Pagoda) Pazundaung Twonship, Yangon, Myanmar",NA,+95 9 42114 7852,info.wathann@gmail.com,http://www.wathannfilmfest.net,NA,https://www.facebook.com/wathannfilmfest,Organizer of the Wathann Film Festival – the very first film festival in Myanmar.,Yearly film festivals since 2011,NA,NA
22,MIDO (Myanmar ICT for Development Organization),https://ngo.mycitizen.net/directory/listing/mido-myanmar-ict-for-development-organization,Information and Communication Technologies for Development (ICT4D),NA,NA,"No. 20, 2nd Floor, Htee Tan 1st Street, Kyee Myin Dine, Yangon, Burma",NA,"+95-95047281, -943025529, -9450025616",info@myanmarido.org,http://myanmarido.org/,NA,https://www.facebook.com/Myanmarido,"Conducting ICT trainings to people across all regions in Myanmar.Organizing seminars and workshops on contemporary ICT technologiesProtecting individual rights of users and sharing ICT knowledge on digital security and privacy.Research and development of laws and policy which safeguard individual users, businesses and entreprenuers. Publishing reports, and collaborating with respective groups and organizations.",MIDO provides the following ICT for development services and toolkits;Provide Seminars on ICT awareness mainly to rural and suburban areasOrganize Workshop on Capacity building on ICTConduct Basic ICT/Computer trainingsResearch and develop Myanmar’s ICT for development reports and papers,NA,NA
