,Organisation,NGO Listing Page,Classified Category,Registration ID,Year of Foundation,Address,Telephone,Mobile,Email,Website,Twitter,Facebook,Description,Activities,Name in Myanmese,Further Links
23,Alternative Asean Network on Burma (ALTSEAN),https://ngo.mycitizen.net/directory/listing/alternative-asean-network-on-burma-altsean,Human Rights/Research/Advocacy/Capacity Building,NA,1996,"PO BOX 296 - Lardprao Post Office, 10310 Bangkok, Thailand",+66 81 850 9008,NA,altsean@altsean.org,http://www.altsean.org,http://twitter.com/altsean,https://www.facebook.com/pages/ALTSEAN-Burma/115467048481589,"ALTSEAN-Burma (Alternative ASEAN Network on Burma) is a network of organizations and individuals based in ASEAN member states working to support the movement for human rights and democracy in Burma. The network is comprised of human rights & social justice NGOs, political parties, think tanks, academics, journalists and student activists.",Chronology of events (2005-2013)Parliament Watch (2011-2013)Regime Watch (2011-2013)UN Dossier (1990-2013)Daw Suu Watch (2005-2013)Electricity Protests Map (2012)By-election Special (2012)Political Prisoners – Free Now (2008-2012)SPDC Who’s Who (2011)2010 Election Watch (2010)8888 Campaign (2008)Burma’s Saffron Revolution (2007),NA,NA
24,Women's Rights and Welfare Association of Burma,https://ngo.mycitizen.net/directory/listing/womens-rights-and-welfare-association-of-burma,Health,NA,1995,"Vikas Puri, New Delhi, Delhi, India",NA,NA,NA,NA,NA,NA,"The Women’s Rights and Welfare Association of Burma (WRWAB) was founded in February 1995 by a group of Burmese women in Delhi. The organization has set up training workshops on women’s rights and health care and encouraged women’s participation in decision making and political mobilization.The WRWAB established a healthcare centre for Burmese migrants in Delhi to provide primary health care and medicines free of cost, as well as to practice minor operations and deliver babies. A certified, experienced nurse from Burma provides treatment. The centre also organizes workshops on health education.",Providing free healthcare to Burmese refugees in Delhi,NA,http://www.mikrogranty.cz/burma/all-projects/health-centre-for-burmese-refugees.html
25,Burma Charity Fund,https://ngo.mycitizen.net/directory/listing/burma-charity-fund,Social Service,NA,2005,"West Delhi, Delhi, India",NA,NA,NA,NA,NA,NA,The Burmese Charity Fund was founded by three Burmese members in 2005. The general purpose of the organization is to help Burmese refugees in Delhi to meet their basic livelihood needs and get access to health care through small cash support. The fund also provides financial assistance to students in need.,Providing social assistance to people in need,NA,http://www.mikrogranty.cz/burma/all-projects/crisis-assistance-for-refugee-families.html
26,Chin Human Rights Organization (Delhi),https://ngo.mycitizen.net/directory/listing/chin-human-rights-organization-delhi,Human Rights/Research/Capacity Building,NA,1995,"West Delhi, Delhi, India",NA,NA,NA,http://www.chro.ca,NA,NA,"Chin Human Rights organization (CHRO) is a non-governmental non-profit organization legally registered in Canada with branch offices in India, Thailand and in the United States.Formed in 1995 by a group of Chin activists who began monitoring human rights situation in Chin State and Western Burma along the borders with India and Bangladesh, the CHRO has grown from a small organization to a well-respected and professionally managed human rights organization. The organization aims to promote and protect the rights of Chin people by educating and empowering them through training/workshops and also through advocacy work. The population served includes Chin in Chin state, Burma, as well as Chin refugees living in such countries as India and Malaysia.",Workshops on how to document Human Rights violations,NA,http://www.mikrogranty.cz/burma/all-projects/human-rights-violations-documentation-and-networking-training.html
27,HIV/AIDS Prevention and Care Centre,https://ngo.mycitizen.net/directory/listing/hivaids-prevention-and-care-centre,HIV/AIDS,NA,2002,"Yangon, Yangon Region, Myanmar",NA,NA,NA,NA,NA,NA,The HIV/AIDS Prevention and Care Centre was founded in 2002 to provide guidance and training about HIV/AIDS. The aim of the organization is to eliminate HIV/AIDS from Burma. Current activities include operation of a community centre to provide basic shelter and medical treatment to HIV/AIDS patients as well as activities to assist with reintegration of HIV/AIDS patients to the society. The organization is fully dependent on individual donations.,Reintegrating HIV/AIDS Patients into society,NA,NA
28,Burmese Social Welfare Association,https://ngo.mycitizen.net/directory/listing/burmese-social-welfare-association,Health/Education,NA,2005,"Aizawl, Mizoram, India",NA,NA,NA,NA,NA,NA,"The Burmese Social Welfare Association was established in May 2005 by Burmese migrant workers in Mizoram state of India. BSWA is comprised of 17 committee members and 3 advisors and among the committee members 3 seats are for female activists. BSWA seeks to provide medical, educational and funeral services for the Burmese migrant workers in Mizoram state, one of the regions highly populated with Burmese migrant workers.",medical care for Burmese migrant workers in Northeastern India,NA,http://www.mikrogranty.cz/burma/all-projects/free-clinic-for-burmese-migrant-workers.html
29,The Matu Herald News Group,https://ngo.mycitizen.net/directory/listing/the-matu-herald-news-group,Media,NA,2008,"Sitapuri, New Delhi",NA,NA,NA,NA,NA,NA,The Matu Herald News Group was established in October 2008. The group seeks to inform all Burmese living outside the country (specifically those from the Matu community living in India) about the political situation inside Burma. The group members also see publishing the journal as a means of non-violent political movement to improve the government of Burma.,Matu Herald News,NA,http://www.mikrogranty.cz/burma/all-projects/the-matu-herald-news.html
30,Burmese Women Delhi,https://ngo.mycitizen.net/directory/listing/burmese-women-delhi,Health/Women/Education,NA,2006,"New Delhi, India",NA,NA,NA,NA,NA,NA,"Burmese Women Delhi was founded in 2006 by 25 women from different communities in Delhi. The organization’s objectives are 1) to reduce violence against women, 2) empower Burmese refugee women in Delhi and 3) link with Indian NGOs and women groups. Main activities include training, a monthly women’s exchange, efforts to bring an end to violence against women, and networking with other organizations.",Training for parents,NA,http://www.mikrogranty.cz/burma/all-projects/helping-children-thrive-training-for-parents.html
31,Social Health and Education Development (SHED),https://ngo.mycitizen.net/directory/listing/social-health-and-education-development-shed,Education/Health,NA,2010,"Mizoram, India",NA,NA,NA,NA,NA,NA,"Social Health and Education Development (SHED) was formed in June 2010 for village health education and to provide limited primary health care to the medically under-served population of Indo-Burma border area. Since 2012, SHED has been concentrating on reaching out to the Burmese refugees in the region to provide health education. The organization aims to raise awareness in health-related issues and also to train medical personnel to be able to provide logistical support for emergency patients such as first-aid services or referring them to bigger medical facilities.",Health education program for residents of the rural areas of the Chin state (Burma) and for Burmese migrants in India,NA,http://www.mikrogranty.cz/burma/all-projects/community-health-awareness-program.html
32,Zomi Community Delhi,https://ngo.mycitizen.net/directory/listing/zomi-community-delhi,Education,NA,2002,"Vikas Puri, West Delhi",NA,NA,NA,NA,NA,NA,"Zomi Community Delhi is a social organization started in 2002 by people from the Zomi ethnic group originating in the Chin State of Burma. The main purpose of the organization is to help fellow Zomi, build unity among the community, integrate with local people, solve problems with others, translate/interpret in different languages, lead/guide newcomers to achieve their goals and promote education.",2011: Zomi Community School,NA,http://www.mikrogranty.cz/burma/all-projects/zomi-community-school.html
33,The Heritage of Mon Culture Group,https://ngo.mycitizen.net/directory/listing/the-heritage-of-mon-culture-group,Music,NA,2003,"Moulmein, Burma",NA,NA,NA,NA,NA,NA,"The Heritage of Mon Culture Group was established in 2003 with its aim to perpetuate and conserve the Mon traditional and cultural heritage throughout the world. Since the establishment, the organization has strived to introduce the Mon culture to the public. The Heritage of Mon Culture Group has produced 30 items of Mon traditional songs and dances with voluntary contributions from its members and supporters. The organization has opened training session of the Mon traditional dance and music in the USA and in Thailand for anyone who is interested.",Training youth how to play the crocodile-shaped instrument.,NA,http://www.mikrogranty.cz/burma/all-projects/keeping-alive-traditional-mon-music.html
34,Health Education Awareness Raising Team (HEART),https://ngo.mycitizen.net/directory/listing/health-education-awareness-raising-team-heart,Health/HIV/AIDS,NA,2013,"Moulmein, Mon, Burma",NA,NA,NA,NA,NA,NA,"Founded in 2013 by a group of medical experts to promote activities related to public health education, HEART aims to raise awareness and prevent public health problems such as HIV/AIDS, Malaria and Tuberculosis. The publications of HEART mainly put its emphasis on preventive care and healthy living.",HIV/AIDS Health Education,NA,http://www.mikrogranty.cz/burma/all-projects/hiv-aids-health-education.html
35,Chin Human Rights Organization (Aizawl),https://ngo.mycitizen.net/directory/listing/chin-human-rights-organization-aizawl,Human Rights/Capacity Building/Research,NA,1995,"Aizawl, Mizoram, India",NA,NA,NA,http://www.chro.ca,NA,NA,"Chin Human Rights organization (CHRO) is a non-governmental non-profit organization legally registered in Canada with branch offices in India, Thailand and in the United States.Formed in 1995 by a group of Chin activists who began monitoring human rights situation in the Chin State and in Western Burma along the borders with India and Bangladesh, the CHRO has grown from a small organization to a well-respected and professionally managed human rights organization. The organization aims to promote and protect the rights of Chin people by educating and empowering them through training/workshops and also through advocacy work. The population served includes Chin in the Chin state, Burma, as well as Chin refugees living in India and Malaysia.",Human Rights Training Manual in Chin Language,NA,http://www.mikrogranty.cz/burma/all-projects/publication-of-human-rights-training-manual.html
36,Mizo Welfare Organization,https://ngo.mycitizen.net/directory/listing/mizo-welfare-organization,Advocacy,NA,2007,"Aizawl, Mizoram",NA,NA,NA,NA,NA,NA,"Mizo Welfare Organization (MWO) was founded in October, 2007 to support the welfare of the Burmese people, promote and protect their culture, improve awareness of human rights and democracy, and unify people living in the Kabaw Valley in Burma as well as community members living in Mizoram. MWO seeks to instill democratic values in Burmese refugees through capacity building and thus to promote democratic transition in Burma. The organization aims to further support women and youth in particular, and to help develop the community as a whole.",Women’s Rights Campaign,NA,http://www.mikrogranty.cz/burma/all-projects/women-s-rights-awareness.html
37,Chin Student Union (CSU),https://ngo.mycitizen.net/directory/listing/chin-student-union-csu,Education,NA,1946,"New Delhi, Delhi, India",NA,NA,NA,NA,NA,NA,"The Chin Student Union was formed in 1946, by a few Chin students at the Rangoon University, to participate in the movement to achieve independence from the British Empire. After the student uprising in Burma on August 8, 1988, leaders were exiled to India and the organization was reformed in 1995. The Chin Student Union’s aims and objectives include helping with the educational and social problems of the Chin people; preserving and promoting the Chin literature, culture, and tradition; and advocating for equality and self-determination in the Union of Burma together with other ethnic organizations.The CSU helps Burmese students and youth to get admission to Indian schools, colleges, and universities. It has organized workshops, trainings, and other activities for Burmese refugees in Delhi. CSC has also collaborated with Tibetan Student Union and Indian Student Union to help Burmese people get access to education in India. The organization serves Burmese refugees all over India and networks with student groups inside as well as outside of Burma.",Seminar for Burmese Youths to inform them about education opportunities at universities and colleges in India.,NA,http://www.mikrogranty.cz/burma/all-projects/university-counseling-seminar.html
38,Chin Refugee Committee,https://ngo.mycitizen.net/directory/listing/chin-refugee-committee,Education/Health/Livelihood and Food Security,NA,1996,"West Delhi, Delhi, India",NA,NA,NA,NA,NA,NA,"Chin Refugee Committee Delhi was established in January 1996 by the Chin people who had fled from persecution in Burma. Since then, CRC has worked to address the problems Chin refugees and asylum seekers face in India.CRC is a community based organization run by 22 members, each representing the different Chin communities of Delhi. The organization aims to look into the affairs of the Chin community and provide relief and assistance in regards to health, education and development of the Chin refugees in Delhi.CRC also endeavors to bring international attention to the situation of the Chin refugees as well as advocating with the UNHCR for legal and financial assistance for refugees.","Counselling, social services2013: Video documentation about refugee lives in Delhi",NA,http://www.mikrogranty.cz/burma/all-projects/documenting-lives-of-refugees-in-delhi.html
39,Zomi Women Union,https://ngo.mycitizen.net/directory/listing/zomi-women-union,Education/Children/Women,NA,2004,"West Delhi, Delhi, India",NA,NA,NA,NA,NA,NA,The aims and activities of the organization are promoting the education and rights of women and children.,2013: training for refugee women,NA,http://www.mikrogranty.cz/burma/all-projects/home-industries.html
40,Delhi Burmese Christian Fellowship,https://ngo.mycitizen.net/directory/listing/delhi-burmese-christian-fellowship,Education,NA,1992,"Janakpuri, New Delhi, Delhi, India",NA,NA,NA,NA,NA,NA,–,since 2011: school for Burmese children in India.,NA,http://www.mikrogranty.cz/burma/all-projects/dbcf-school.html
41,Radanar Ayar Rural Development Association,https://ngo.mycitizen.net/directory/listing/radanar-ayar-rural-development-association,Livelihood and Food Security/Rural Development/Development Aid/Health,NA,NA,"Bogale, Ayeyarwady, Myanmar",+95-45-45 837,+95-9-4959 0446~ 0448,info@radanarayar.org,http://www.radanarayar.org,http://twitter.com/ThuraAungMSc,http://www.facebook.com/RadanarAyarAssociation,"Poverty reduction by offering an enabling environment to all stakeholders through improved governance and environmentally feasible for the right-livelihood interventions and Partnership building at all levels will supplement and ensure the goal of sustainable development which is socially, environmentally, politically and legally feasible missions of emergency and development conditions.","Thematic Areas of WorkSustainable AgricultureCSO Strengthening Initiatives Disaster Managements (Preparedness and Responses) Private and Public Partnerships Non Formal EducationPrimary Health CarePlanned for Future ActivitiesCommunity Physical infrastructure projects Primary Health CareHIV/AIDS Prevention, Care and SupportSustainable Natural Resource ManagementEducation and Literacy projectsHuman/ Labor rightsPoverty alleviation through micro credit, enterprise development& skill development initiativesAwareness, education and advocacy through (documentaries, theaters, printedmaterial, seminars and workshops) Institutional DevelopmentRadanar Ayar is a growing organization and has been passed through the phase of consolidation, organizational development. The organization has been certified by Transparency under Euro parliamentary and Euro Commission and General Consultative Status to United Nations Economic and Social Section (ECOSOC-UN).Partnerships and NetworkingRadanar Ayar signed several Memoranda for the Basic Agreements for cooperation with the following Institutions and Agencies.United Nations Office for the Project Services – carry out LIFT fund ( a multi donors fund for poverty alleviation)Badeidha Moe CSO- a Woman Led Organisation carry out civil society strengthening initiatives and basic protections and right-based matters including women and child rights interventions.Sphere Project Office in Geneva- carry out Sphere Minimum standards and disseminations of Humanitarian charter and Minimum Standards in Humanitarian Responses and Sphere training service for the improvements of disaster managements in Humanitarian Contacts.Save the Children’s Fund- for civil society strengthening initiatives carried out that supports on cooperation and better coordination mechanism in both local and at national levels.United Nations Office for the Co ordinations of Humanitarian Affairs (UN OCHA)- closed contacts for the Myanmar Information Management Unit (MiMU) and general contacts for Humanitarian actions in Myanmar.Professional and Network, Working Groups MembershipMyanmar NGO Network (MNN)- member organisation to MNN since 2009 and active body in general consultations of development and humanitarian coordination.Accountability and Learning Working Group (ALWG)- actively involved in better focus on learning and sharing of accountability and transparency practices, lesson learnt, sharing experiences on Complaint, Feed Back and Responses Mechanism . Better cooperation in strategic actions developments and capacity enhancement events.Myanmar NGO Consortium on DRR- MNC-DRR- coordinating body of the disaster risk reduction and disaster preparedness sectors in collaboration with Expatriates Groups and such Agencies.DRR Working Group (DRRWG)- member agency of the Disaster Risk Reductions and closed coordination with Department of Relief and Resettlements under the Ministry of Social Welfare, Relief and Resettlement, Asian Disaster Preparedness Center (ADPC) and UN Treaty Bodies and Leads to IASC- United Nations Development Programme (UNDP) and Unicef.Signing to Global Initiatives",ရတနာဧရာ ကျေးလက်ဒေသလူမှုဖွံ့ဖြိုးတိုးတက်ရေးအသင်း,NA
42,Kuki Women's Human Rights Organization (Burma) (KWHRO),https://ngo.mycitizen.net/directory/listing/kuki-womens-human-rights-organization-burma-kwhro,Women/Capacity Building/Peace Promotion/Reproductive Health,NA,NA,"Ward No. 2, Moreh, Chandel District, Manipur, India","+913872264568, +919436872556",NA,kwhro2013@gmail.com,NA,NA,NA,"Mission: to work for women empowerment, to work for increased participation of women in politics & peace reconciliation process in Burmareproductive training,peace training & awareness program,women against violence program (discussion)political awareness & discussion,field work (inside Burma)",6th conference of KWHROpress conference on Thamanti Dam,NA,NA
43,BusinessKind Myanmar,https://ngo.mycitizen.net/directory/listing/businesskind-myanmar,Children/Women/Social Business,NA,NA,"Dr. Helen Gunthorpe, International Director, Room - 37, Building 1, 4 Floor, Civil Development Building (North) 8 mile junction, Corner of Pyay Rd. and Kabaraye Pagoda Rd., Mayangone Township, Yangon, Myanmar",NA,"09- 7321 4887, 09- 8 624 625, 09- 500 40 60",cathywin@gmail.com,NA,NA,NA,"BusinessKind-Myanmar (BK-M) is a small non-profit NGO based in Yangon, Myanmar. Its mission is to develop small community based neutral profit businesses that produce affordable products that improve the daily living conditions of poor people. BKM is operating by women for women.Factory Address#A1, Hti Hlaing Shin Housing, Kyan-sit-thar Road,Hlaing Tharyar Township, Yangon, Myanmar.Tel: 09- 7321 4887, 09- 8 624 625, 09- 500 40 60","BKM Directed Social BusinessesGoodSleep: Neutral-profit Community Based Bed Net BusinessGoodNight: Neutral-profit Community Based Citronella Candle BusinessGoodJob: Industrial sewing training and garment factory job vetting and mentoring programMoe Thauk Pan High School Boarding Home in Latbutta (Delta)These businesses are managed and operated by women most of whom are women living with HIV-AIDS.Grant WorkOver the past 3 years I have managed the equivalent of $109,000 of grant work.ExistingMobilization of Garment Workers and Factory Owners(United States Embassy – $41,000) CompletedGood Job – Income generation for Cyclone Nargis’s vulnerable women (ACTED)Community based malaria/dengue fever prevention/education project (French Embassy)Community based malaria/dengue fever prevention/education project, distribution of bed net and citronella candle making business (International Rescue Committee- IRC)Children Dental Health Fluoride application Project (Burnet Institute)Community based malaria/Dengue Fever Prevention/education project, distribution of bed net and set up of citronella candle making business in Hlaing Tharyar (United States Embassy)Malaria/Dengue Fever Prevention, ITNs bed net production and distribution and Industrial Sewing Skill Training and link with employment for community women (British Embassy)",NA,NA
44,Karuna Myanmar Social Services (KMSS),https://ngo.mycitizen.net/directory/listing/karuna-myanmar-social-services-kmss,"Education/Children/Women/Water, Sanitation and Hygiene (WASH)/Disaster risk reduction (DRR)/HIV/AIDS/Internally Displaced Persons (IDPs)",NA,NA,"No.292(A), Pyay Road, Sanchaung Township, Yangon",NA,NA,NA,NA,NA,NA,To serve the poor and the needy by motivating and empowering them towards quality and dignity of life based on the social teachings of the Church.,"Livelihoods, IDPs (Kachin, Shan), Health(HIV/AIDS), WASH (IDP Camps), Shelter (IDP Camps), Education (Scholarship, Kindergarten), DRR and Protection (Children and Women)",NA,NA
45,Austrian Burma Center,https://ngo.mycitizen.net/directory/listing/austrian-burma-center,Advocacy/Development Aid/Human Rights/Refugees/Women,NA,2005,"Vienna, Austria",NA,+43-68120886499,info@austrianburmacenter.at,http://www.austrianburmacenter.at,NA,NA,Human RightsRefugee SupportDevelopment Assistance,‘jute dreams’Income generation project for Chin refugee women in New Delhi.Attractive jute gift bags for Europa. Please order.,NA,NA
46,Burma Aktion,https://ngo.mycitizen.net/directory/listing/burma-aktion,Advocacy/Human Rights/Media,NA,2007,"Essen, Germany",NA,NA,kontakt@burmaaktion.de.vu,http://burmaaktion.de.vu/,NA,NA,"It is our aim to inform the general public, media and the German government about the true situation in Burma. To understand the present-day situation and problems it is essential to know about Burma’s history.It is our clear aim to struggle for a real democracy, equality of all ethnic people, an end of racism, human-rights discrimination and the civil-wars against the ethnic minorities. We are the voice of the people in Burma and share our solidarity with them. Therefore, our efforts are for the people according to their wishes, dreams and desires.We help these ideas to get a voice that is heard by the general public and the media and that the German government will listen to this voice to use their influence for a fundamental change in Burma.","We have organised some lectures during this year to inform about the situation of the ethnic minorities, the human-rights abuses against them and the decades long civil-wars.Continuously we publish articles and essays to explain the current situation in Burma and inform the media and the German government for a positive change for the people in Burma.",NA,NA
